Season Nbr,Episode Nbr,Title,Score,Comment
3,11, High optimism,8.0,"This review contains spoilers.""San Junipero"" is the fourth episode in the third season of Black Mirror. The episode is directed by Owen Harris and written by Charlie Brooker. The episode is set during the 1980s in a town named San Junipero. The episode focuses on the relation between Yorkie and Kelly.""San Junipero"" is an incredibly optimistic episode of Black Mirror. This episode features a technology where the elderly characters in the episode can live out a life in the 1980s that exists in the cloud. This episode features a use of technology that is portrayed as optimistic. The use of uploading people into the cloud allows the characters to actually live out their lives without regrets. This episode contrasted well with the bleak episodes of earlier Black Mirror episodes.""San Junipero"" features great direction and the faux 1980s style being used to great effect. This episode is among one of the best directed and produced Black Mirror episodes. The acting by the two lead characters are also great as well. The setting for this episode is not only used for convenience and it plays into the plot's writing. Yorkie's revelation that she had become crippled after coming out makes sense if it had happened in the 1980s. It also made her acceptance of the technology completely understandable.The ending of this episode is incredibly hopeful for the use of technology to allow broken characters a chance. I would recommend the fourth episode of the third season ""San Junipero"".Grade: B"
3,11, The chemistry between the actors is the episode's saving grace.,7.0,"The problem with this episode is that it is too long. It waits too long to reveal the twist, and then draws things out too much afterwards. It could have told the same story in less time and been more effective. As it is, it really starts to drag. Just because Netflix allowed them to make the episode and hour long doesn't mean they should have. The episode has an interesting enough story, it is just stretched beyond its logical length. As a result, I liked the episode far less than I should have. The actors have great chemistry. I really felt invested in the relationship that was built between them.The episode is set in San Junipero, a party town in the 80's. A shy girl is there on vacation when she goes into a bar and meets another girl. That is the plot of the entire first half of the episode. Then there is a twist, and the plot picks up a bit, but still moves quite slowly."
3,11, Very Touching,9.0,"I started watching this episode and had absolutely no clue what was going on. It was different from all the other episodes of Black Mirror and seemed to be revolving around a love story. It felt boring at first, but once it's revealed what is actually going on, I felt it was a brilliant portrayal of love, lost youth, and yearning. Compared to the darker and sometimes disturbing previous episodes, I thought this was beautiful. It actually brought a tear to my eye. Beautifully shot and acted. Just wonderful to watch."
3,11," After Waldo, this one is boring too",5.0,"One of the boring episode of Black Mirror, I guess they must did this to please the minority. So this one is like running from the black mirror's main theme that exist to show how technology affect human. This one? Its just a love story between outgoing girl and a nerd, girl. Thanks hollywood."
3,11, Sweetest episode,10.0,"San Junipero is an eccentric love story. It begins in the 1980s in a beautiful small town, where two young women meet in a bar and fall in love. But that's not it. I love the production design. It looked like an authentic 1980s movie. The acting of the two female leads are amazing. The story is by far the most emotional and touching one since Be Right Back."
3,11, This episode is so good it may well have been a movie!,10.0,"Everything about this episode was just amazing. I'm a black mirror fan but compared to a last few episodes this was simply mind- blowing. I kept wondering how this is not a movie. I mean it has the production quality, script, acting, sci-fi elements of a movie like ""Her"". The presentation is also very interesting and keeps you guessing what is happening all along. What's most interesting about this episode is that apart from a simple love story, it also contains deep questions about what happens when you enter a world where you have access to everything and you can control everything, i.e. when sex, money, and all the worldly things become immaterial. Do you still get pleasure from dressing up, hookups, orgies, etc? Or is true love the only important thing that remains when you can live for eternity and worldly things don't matter. Brilliant concept and execution... hats off!"
3,11, Beautifully different,9.0,"San Junipero is quite different than the other BM episodes. The plot and characters are somewhat stereotypical, but the rest of the episode makes up for it.The episode focuses on death, mourning and after-life (from both the classical and technological perspective). Although I knew the ""twist"" before, the episode was still very enjoybale. Acting is good, the 80's atmosphere is top-notch (great soundtrack - Heaven Is a Place on Earth).While other Black Mirror episodes are always depressing in some way, San Junipero shines thanks to its uniqueness and optimism."
3,11, TCKR,9.0,How to escape life to live for eternity that's the question that all humans are trying to deceive.But I believe that death is a beautiful thing.
3,12," Very disturbing...and if they COULD do this, I bet they would....",10.0,"Although it's from season three, this is the first episode I saw of ""Black Mirror""...and considering how good it is, it was a good place to start.The show is set in the near future. Soldiers from some sort of international armed forces unit are battling 'roaches', though the roaches aren't bugs but people...or they are kinda people. While they are humanoid, their mouths are freaking and inhuman and so is their language. They are very scary looking...and the soldiers know it's only proper that these 'things' are wiped out once and for all. The problem is that one of the soldiers is having problems with his implants...and they all receive some sort of implants...and where this goes is what makes this one memorable and exciting to watch.This show has a lot to say...but I don't want to discuss this now since you may not have seen the show and talking about the implants would ruin the suspense. Suffice to say, the show is clever and a bit of a scare since it seems possible such horrible technology COULD one day be created."
3,12, The Military Mind,7.0,"I truly believe that the most money and direction in most political entities is to give carte blanche to something military. Since survival is the most basic human emotion, we tend to want anything that facilitates that. When we talk about the advancement of culture, education, agriculture, infrastructure, the amount of money given to these is piddly compared to the military. And I'm talking about most countries in the world, not just ours. Think of Syria and Russia and northern African nations. I believe that if the kind of technology existed that was portrayed in this episode, there would be a group of zealots that would embrace it lovingly. Get rid of inferiority in our genetic make-up. The ""Roaches"" are just people with imperfections (as we all have) like possible cancer. Anyway, this is a really disturbing episode because it is possible. Hitler used the same premises that these guys did. Throw in religion, which is equally dangerous because it preaches its own superiority, and you've got the seeds of the worst kind of world."
3,12, The Future Soldier,8.0,"In a post-apocalyptic near future, soldiers using implants that enhances their senses and provide data of their missions are fighting mutants called Roaches. When the squad of the rookie ""Stripe"" is assigned to help villagers that had their supplies stolen by roaches, they learn that they have head to the house of a farmer. The soldiers find a hideout of roaches and kill them. However one of the creatures points a device to Stripe but he is killed by the soldier. Soon his implant glitches every now and then and he is submitted to a medical examination and visits a psychologist and learns that he does not have any problem. On his next assignment, Stripe, Medina and Rai are assigned to another mission and Medina is killed by a sniper. Stripe and Rai enter in the building to hunt down the sniper. But soon Stripe learns the truth about the roaches and the purpose of the implants.""Men Against Fire"" is a scary view of the use of technology by the Lords of War in the warfare. Today it may be still fiction, but the way this industry is developing, it might be possible some interface to control and improve the soldiers' feelings and senses. My vote is eight.Title (Brazil): ""Men Against Fire"""
3,12, Intensely disturbing.,9.0,"Men against Fire is a classic episode of Black Mirror, it has so many things going for it, but for me, it's the what if scenario posed by the episode that's most impactful. It asks the terrifying question, what if the Military could command what soldiers saw? What if they had the ability to remove free will. It is a terrifying scenario, removing conscience from the military.Malachi Kirby and Michael Kelly are both incredible, Kirby injects a life, a compassion and a sense of awareness into his performance, he in particular was superb.Easy to follow, despite dealing with complex subjects, it never feels too clever for its own good. Very well made indeed, superb production values, as always.Powerful, hard hitting drama 9/10."
3,12," ""Mass lets you do it.""",8.0,"In the story, they call it 'Mass' - an implant that screens out all distractions to war and the killing task at hand. Soldiers will not be sidelined by the sights, sounds and smells of war, death and killing. What startled me, and I don't know if it's true or not until I research it, was Arquette's (Michael Kelly) explanation that during World War I and II, only fifteen to twenty percent of Allied soldiers ever fired their weapons, and in many of those instances, over the heads of the enemy. That was just a stunning revelation. So the effort to desensitize soldiers by removing inhibitions seems like a logical step. All very frightening, because it makes the art of killing even more removed from human consideration. And yet in the scenario offered to Stripe (Malachi Kirby), he was allowed a choice to mind-wipe himself again or relive the horror of hunting roaches. The failure of the episode lies in it's inability to explain why the 'roaches' appear as vampires but the Danish citizens in the countryside being terrorized by them appear normal. How does the Mass implant distinguish between the two?"
3,12," War, what is it good for?",6.0,"This is a deep episode that questions the morality of war, and whether a war can be a ""good one"". This episode doesn't rank highly amongst the Black Mirror fans, but it has a very serious tone that seeks to get the audience pondering about how the good guys see the bad ones. What is right? What is wrong? What are the grey areas?"
3,12, 5,5.0,"Very bland episode with basic plot, nothing interesting, whole hour full of lack action."
3,12," The weakest in the season, or more precisely, the least good",7.0,"Another futuristic episode, judging by the language, is located in Denmark, in a military base that trains super-soldiers with brain implants, to hunt for mutants that threaten the survival of the human race. But when one of the soldiers' implant breaks down, he begins to realize that he is living a lie and that things are not as they seemed.The fact is that this episode does not bring the original story, but is a fairly faithful copy of the 1998 episode ""Hearts and Minds"" of the series ""The Outer Limits"". But we certainly live in an era of remakes and reboots, accustomed to a serious shortage of original ideas, and personally, I have never had a problem with loans of this type, if the result is quality.""Men Against Fire"" sticks to the basic idea of the ""Black Mirror"" series and brings us another possible abuse of modern technologies in the near future. It criticizes war propaganda and brainwashing, as well as the tendency of an individual to, although enlightened, side with the majority and opt for a line of least resistance.The episode is an SF drama, with horror influences and the inevitable plot twist. It is well filmed and acted, and the horror moments are effective. However, previous episodes have raised my criteria to a fairly high level, with which ""Men Against Fire"" fails to keep up. Even if I hadn't watched ""The Outer Limits"", the story didn't bring me anything new and it didn't manage to interest me in the characters and their destinies, and the general atmosphere, compared to the rest of the series, was lukewarm.7/10."
3,12, Predictable but good.,8.0,"Black MirrorMen Against Fire (4 out of 5 stars).This episode delivers another mind bending story with a social commentary message hidden in the theme. Which can try to be relatable to the real world political/ warfare theme. It has an interesting plot without trying to give much away about the twist. I did find the twist to be predictable with this one. The plot follows Stripe (Malachi Kirby) and Hunter (Madeline Brewer) who are in a military squad. Preparing to exterminate ""roaches"" which is mutated infected people. While Stripe begins to have visions during the mission. Which there can be something more that is hidden in there mission.It has a sharp entertaining direction. As the squad is walking through a wasteland of an apocalyptic future. I thought the twist has been done before in another science fiction movie which is interesting but predictable."
3,12, Eugenics Pick N Mix,6.0,"OkAt first I thought it was a pretty unoriginal take on a zombie movie, which it kind of is. The twist is simply that the ""zombies"" are just people with bad genetic traits. I was actually really enjoying the story for the first half or so.A better twist for the episode would have been to have the device show the roaches as normal people - when in fact they really do have a dangerous contagious sickness, and it turns out the military are actually justifiable in their actions. At least then it would give the viewer something to think about. As it stands, it's completely obvious from the start that the roaches will turn out to be innocent people.As another reviewer mentioned, history and the present day continue to show us that certain humans need no excuses to oppress others and visit violence upon other people who are different. The idea that a human would only kill another human if they resemble a literal monster is absurd to the point of farce - completely divorced from the reality of the world and human nature. A regime can always find violent thugs ready to get out there and guiltlessly follow orders.The eugenics angle seems a little silly. If they had the blood results for these undesirables, why would they be eliminating them in such a haphazard way? Why wouldn't they take care of them at the time of the testing? It's possible I misunderstood the nature of the testing, or that they only decided later on to exterminate these people, or that they somehow escaped. I guess the bloodwork results wouldn't be instant. This version of administering eugenics just comes off as goofy.It just seems odd to me that if the elites decided to exterminate these ""inferior"" people, that they would do it in such a bizarre way. The logic is that they want future generations to inherit good traits, but the world the ""normal"" villagers are living in looks crummy as hell anyway. It doesn't seem to me like they are caring about quality of life for the ""normal"" people, so why would they care so much if they got some bad genes? Wouldn't it make more sense for the well bred powerful people just to isolate themselves away from the undesirables?The ideas of fascism and eugenics are completely unoriginal- to the point that the villain comes off as a one dimensional moustache Twirler. For this episode to be compelling you need to be able to sympathise with the villain in some way.It really just feels like this world is unrealistic and the episode didn't do a great job of explaining the logic of the world."
3,12, The weakest episode so far,2.0,"I am following the series in chronological order and so far, I found something interesting in each episode. Unfortunately, this story is just a banal politically correct statement.It is based on the unrealistic premises that human beings are too sympathetic a species to inflict pain willingly. However, history constantly proves that men are quite eager to hurt others.Being it fuelled by ideological or tribal reasons, or just pure sadism, there is no shortage of violence in our past (and present). You just need to check the torture instruments invented throughout the centuries (and still used nowadays), to understand that no brainwashing is required to convince somebody to hurt someone else.Perhaps it does take some natural inclination, but not much convincing.. and if during WWII only 20% of soldiers actually aimed at the enemy, how come 70 million people died? Did they purposely stumble on bullets?Anyway, the plot is about a marine brainwashed by a cybernetic device called MASS into killing people with defective DNA - though it is not clear why somebody against violence would join the marines to start with....PS and if the authors wanted to make a powerful statement, maybe they should have considered religious brainwashing instead of the military - which has been done way too many times before. But I guess that would have been way too controversial and Black Mirror stops short of controversy."
3,12, Coulda been better!,7.0,"In the grand scheme, it's very generic, to say the least. But some revalations at the last act proved it has some nuances that are enough to make it mildly refreshing, and kinda smart, at its core. It was all about the execution itself that saved the best, the meat of the story, for the last, and utilized it as a plot-twist rather than building upon it.(7/10)"
3,12, Heavy handed,8.0,"This review contains spoilers.The fifth episode of the third season of Black Mirror is entitled ""Man Against Fire"". The episode is directed by Jakob Verbruggen and written by Charlie Brooker. The episode stars Malachi Kirby as Stripe, a soldier in the military. Stripe is forced to confront his past actions after a successful raid against mutants.The episode is absolutely heavy handed in the delivery of its message. The episode has MASS implants creating illusions of mutated creatures such that Stripe and his squad annihilate them. The episode does not have much subtlety in the execution of the concept. It became apparent as the episode went on that the plot attempts this as a twist. The plot of this episode is still engaging. The plots suspense is not as engaging as the direction.The acting by Malachi Kirby deserves mention. He does a fantastic job with the role and it certainly shows on the screen. Likewise, the other supporting actors play up to par. The episode is not weak in the acting or direction.Despite the lack of surprise in the plot I still enjoyed ""Man Against Fire"". The episode is a solid addition to Black Mirror. I would recommend ""Man Against Fire"".Grade: B"
3,12, unique take on common trope,7.0,"neat stuff, sick. not possible to properly review episode without spoilers, as tends to be the case with the series. The topic for this week is genetic engineering, eugenics, genetic diseases, and that sort of thing, probably most famously covered in science fiction by the movie ""Gattaca"".the initial conceit is what may be some manner of minor post-apocalypse, in which soldiers with combat-enhancing implants hunt down and kill shrieking deformed monster-people called ""Roaches"". Then one of them hits the protagonist with an electronic tube with green lights, and stuff starts changing for him.the big reveal is that there are no ""Roaches"", at least in terms of what the soldiers see; their implants directly affect their cognition (all their senses, not just sight) so that they see designated people they have to kill as shrieking monsters. they are actually killing normal civilian people who are ""genetically inferior"", pre-disposed to genetic deformations, diseases, illnesses, mental disorders, that sort of thing.rather than handle the situation in a soft bigotry type of way like in ""Gattaca"" (where these types of people are tolerated but essentially second-class citizens) or trying to gently exterminate this via eugenics programs, the people in this episode have gone a seemingly overly complicated path to exterminate people with inferior genes, while also fixing the supposed ""problem"" of soldiers in war being hesitant to kill their enemies, ending up going out of their way to avoid actually hitting their opponent.by literally dehumanizing their opponent, the soldiers can kill their enemies mercilessly with no lingering effects of PTSD or combat fatigue or mercy to their enemies.while an interesting conceit, the execution seems troubled, with it taking just a bit too long and in a roundabout way to get to the big reveal, and then having to have it all explained in two separate Expo Dump monologues that end up leaving a small window of interesting self-reflection followed by heaping portions of fridge logic that linger long afterwards. Some of the major issues that you think up later; 1) Only the soldiers have the implant which makes genetic inferiors look like ""Roaches"". Thus, the other civilians in the area know that the ""Roaches"" are normal people who are infected. It seems highly likely that there would be a lot more people than the one supposedly crazy religious man hiding ""Roaches"" in their homes and keeping them safe, and that interactions between the soldiers and the civilians would eventually lead to the realization by one side or another that the ""Roaches"" aren't actually monsters.2) The episode does a great job of avoiding any significant Nazi parallels, but I cannot imagine this situation they have of implanting soldiers to make them see the enemy as monsters would be universally accepted among all nations and/or fighting forces. It would seem that having one nation and/or one army going around mass murdering civilians in a European country they deem to be ""genetically inferior"" would not be a situation that would escape notice of other countries, who would most likely end up eventually uniting and attacking them to stop them.3) Given the level of technology they have, it would be utterly impossible to keep something like this a secret."
3,12," With a great thought provoking premise and smart execution, Men Against Fire is one of Black Mirror's best",9.0,"Right now, this and Be Right Back are head and shoulders above all other BM episodes for me (with 9 still to watch). I really loved this one. It's an exciting plot with a great twist that makes perfect sense, and has a rich ambiguous message. In varying ways it gets at government propaganda, the psychological effects of war, human nature, and the difficulty of resistance. Extremely well executed, and the ambiguous ending is fantastic. We know what his decision is - but what do his tears represent? Also dope to see my girl Shiv (Sarah Snook) here. This is a really great episode with much more complex and compelling moral considerations than many episodes of the show."
3,12, The season's most thought-provoking episode,7.0,"To me, this episode felt more like an episode of Black Mirror than any other this season. The thing I like most about this series is the way that it makes me ask myself ethical questions that I never would have thought about otherwise while I'm watching. It brings up the topic of morality relative to near future technology. That is what has been in some ways lacking from this season... until this episode. Admittedly, the episode is a little bit heavy-handed at times, a little predictable at others. But at least it was working with big ideas, putting them out there, and making me think. For that reason and that reason alone, I liked it more than any other this season.The episode follows future soldiers as they hunt down and kill genetically inferior ""roaches"" in some part of Europe. The subjects of eugenics, consent, and propaganda in the modern age are all brought into question by the episode."
