Season Nbr,Episode Nbr,Title,Score,Comment
2,5, make no sense,2.0,"another reviewer had it right that there's too much going on in this episode, to the point that, sticking with one theme makes it a painfully blunt, semi-clever take on the ""bystander effect"". Sticking with the other (as it eventually did) makes it not make sense.the idea of wiping a criminal's memory and then punishing their new ""personality"" is a subject handled much better in a show like Babylon 5 with Brad Douriff playing a priest traumatized by nightmares of murder, to which it's revealed he used to be a serial killer who was basically ""repurposed"" as a useful member of society.here, the criminal's memory is wiped, then they're punished with an elaborate nonsensical scenario that has absolutely nothing to do with the nature of their crime, then at the very end everything is revealed to them and they're given a ""walk of shame"" moment while basically completely oblivious as to what the hell just happened.personally the concept of ""punishing"" a criminal by wiping their memory and then punishing them is immoral and nonsensical, as by wiping their memory you've essentially created a whole new person, and you're now tormenting that person for the crimes of someone else. Even leaving that aside, the ""punishment"" makes no sense relative to the crime and by repeatedly wiping their memory and doing it all over again it completely defeats the purpose.but all of that is resolved in the mid-credits sequence of clips which show this is all basically an amusement park designed to make money off people paying to watch someone suffer in a post-apocalyptic hellscape then yell at them afterwards, adding a third, poorly executed moral theme about commercializing suffering or something that could've been done better"
2,5, OMG should i feel sorry or not ?,10.0,"Test your humanity
The poor girl , wakes , frightened, unsure and disoriented. Asking for help , being chased by a crazy man with a shot gun whilst passer bys take photos and film on phones. As the craziest of situations continues her life is put at risk multiple times when all of a sudden.Crack!Black Mirror of course and one of the most head thumping twists as you now thinking does she deserve it, how bad are we for thinking this way.Why do you do this Brooker?"
2,5, Unalloyed irony and hypocrisy,8.0,"Funny how these two words don't seem to come up, at least in the comments and reviews I have read, yet they're what this episode is all about. Irony and hypocrisy.Without wanting to say too much, although I've flagged this comment as containing a spoiler (first time I've used this function), the denouement makes clear that the many dozens--hundreds even! --of people involved in this project, are guilty of quite cruel hypocrisy--they are engaging in precisely the behavior that they claim to be helping to punish--and are part of a spectacle that is as ironic as can be imagined.For this reason I've rated this episode fairly highly, although I don't believe the interests of verisimilitude have been served. I don't believe--and certainly don't want to believe-that any significant number of people could be so heartless, so utterly devoid of human empathy."
2,5, Oh. My. God,10.0,"That twist at the end was something..Sure I understand the complaint that this episode is just a woman screaming and running around for 40 minutes but it's the point. The episode put us in the shoes of Victoria, confused and scared of what is happening and in the end, one of the best plot twists ever happens."
2,5, Fatally Flawed,2.0,"Whoever wrote the script for this is an idiot. Okay, so the woman videoed her fiance killing a child. Yup, that is completely awful. However, when you wipe out someone's entire memory, you have changed the person. She no longer remembers the crime and is not any longer the person who did it.This episode takes a completely new person and subjects them to torture over and over again. It's not punishment because she has no knowledge of her crime. When a person cannot understand why they are being punished, the punishment is pointless. And no, showing her the video at the end does not solve this problem. It makes it worse. Because regardless, it is a different person.Beyond stupid and easily the worst Black Mirror."
2,5, A powerful message that will only be absorbed by a few.,8.0,"WHITE BEAR's plot does not stand up to intensive scrutiny or logical dissection, however the message behind it's premise is abundantly clear. But the message will only be recognized by those of us who haven't already descended into this hellish, jaded world. This episode seems to be taking crime and punishment to the extreme, but it isn't really about that.The episode accurately portrays us as being trained to treat world-wide tragedies as entertainment. After all, today's reporters jostle for space to film burned, shot and broken people to get the money shot of blood, tears, screams and destruction, while passers-by look on.Exceptional situations are no longer a prompt for action for most of us. A degradation of our morals allow us to watch and wait for someone else to fix the issue for us. It reminds me of the YouTube comments I read when someone uploads a car accident. The priority is on the way the camera is held rather than the upside down bus full of injured children.Why do we now reach for a camera rather than the first aid kit when a friend hurts themselves? What are we becoming? How far down this path will we go?All very interesting questions that came up for me after watching WHITE BEAR."
2,6, Sadly....I don't think we're very far from this at all.,9.0,"""Black Mirror"" is a British series that consisted of two episodes...until Netflix got involved and commissioned more episodes. This episode is one of the original ones.Waldo is an animated television character who is done LIVE using modern motion-capture technology. He is voiced by an out of work comedian, so you know the character is quick-witted. But he's also crude, offensive and annoying...yet the public seems to love Waldo and his offensive antics...so much that they decide to unleash him on a local election for Parliament. He pretty much makes a mockery of the election and despite how offensive and awful Waldo is the public love him. At this point...Waldo's voice starts to worry where all this is headed.This is a very prescient episode of ""Black Mirror"". I think it gauges the public and their sheep mentality quite accurately...especially in light of some of our recent elections. I don't want to make this a political rant...just see this clever and very insightful show."
2,6, Is This the Future,6.0,"Another dystopian venture. In this one, a cartoon bear named Waldo confronts the establishment politicians with obscene and acerbic comments. The guy who voices him is a two-bit comedian who simply howls insults, but catches on. There are times when the voters get a feeling of being disenfranchised and go for the lowest common denominator. We are currently in a period of populism, which usually mean the dumb, uninformed people are handed power. People who have no knowledge of infrastructure, human rights, or basic decency. The scariest thing is that these things have gone global. This episode also implies that there are forces who know how to manipulate all this craziness to destroy people who do good. I guess, there's so much cynicism here that the whole thing turned me off. Just too simplistic to work. But still we need to beware."
2,6, Searching for the New in Politics,7.0,"The comedian Jamie Salter (Daniel Rigby) has created the blue cartoon bear Waldo and provides voice and movements to the character. Waldo is the host of a night show where he interviews politicians to humiliate them. When the conservative politician Liam Monroe (Tobias Menzies), who is the leader in the researches, is irritated by Waldo during a show, his producer Tamsin (Christina Chong) and the television owner Jack Napier (Jason Flemyng) decide to follow Monroe along his campaign to disturb him against Jamie's will. Waldo becomes popular and people decides to vote him to protest against politician. Meanwhile Jamie has one night stand with the Labour Party candidate Gwendolyn Harris (Chloe Pirrie) and they fall in love with each other. However Gwendolyn is advised by the party adviser to keep distance from Jamie during the campaign since he might use inside information in his show. During a debate, Monroe uses the information he has about Jamie and offends him. Jamie has an anger outburst and attacks Monroe and Gwendolyn. What will be the consequences in the upcoming election?""The Waldo Moment"" is a ""Black Mirror"" show with a great idea – the search for the new in politics. A clown was recently elected congressman in Brazil with the largest number of votes in a clear demonstration of dissatisfaction of the Brazilian voters with the politicians. Waldo would be a similar case in the plot. However, director Bryn Higgins shows heavy hand and what could have been a great satire becomes a deep drama. My vote is seven.Title (Brazil): Not Available"
2,6, Vote Waldo!,7.0,"Of all the episodes of Black Mirror that I've seen, this one seems the least far fetched, when you look at the state of The UK right now politically, this doesn't seem too far off, people are so detached politically right now, that I can believe in this.It doesn't have the depth of other episodes, when you consider that this followed White Bear in particular, it does lack any sort of shock factor, or any real emotional depth.The moment where Jamie attacks the MPs is great, he clearly doesn't handle rejection well.Politics in 2018, I could vote for a blue bear.As a political geek I enjoyed this one, and love its relevance, but I get that the appeal to this one is more limited. Daniel Rigby and Tobias Menzies are both terrific.Better then it's perceived. 7/10"
2,6," ""I'm the vote of a blue bear.""",5.0,"Episodes like this lose me when they get over the top obscene and vulgar like this one did. You don't have to be a prude to get turned off, but when it's relentless and unbalanced by an effective, opposing point of view, then I don't see any value in maintaining my interest. One can see however how things are generally trending this way in the life of our political discourse. Pretty soon, the candidates themselves will be throwing the 'F' word around and at each other during a prime time debate. To his credit, Jamie Salter (Daniel Rigby), the voice of Waldo, wanted none of it when his producers put him in the running for an election to Parliament. Waldo's second place finish under the guidance of Jack (Jason Flemyng) seemed like a pretty good wake up call to a society that places more emphasis on crude celebrity than credible ideas on how to improve society."
2,6," Terrific, ruthless satire",10.0,"The Waldo Moment, one if the high points of the early Black Mirror series, captures what happens when animated and/or satirical things come up in popular life, including politics, especially in the UK (remember that nominee for PM who was literally like a black helmeted knight out of Monty Python, Lord whoever). We love cartoons because of the abstraction of it, that they can represent so much that we don't face when it is a regular flesh and blood person in front of us. Think of South Park and Family Guy, or as a human example Stephen Colbert back when he was Colbert of the Report. The Waldo Moment captures all of the mania that comes with a figure, a joke, a walking talking prank, getting the attention of a public who can be so easily galvanized. One may see Jason Flemyng as the cynical villain - a character out of Chayefsky's Network (this reminded me of that too). It might not have the twists of other Black Mirror parts, and if I have any real mark against it I almost wish it was longer than its usual 40 minute show length. But it tells its story with excellent conviction, and recent times have beared out (no pun intended.. Ok a little) what it is saying. It gets in and gets out and does even better what the first episode of this series tried to do with the PM and sex with a pig, which was a solid concept done somewhat typically."
2,6," Populist and populism, kind of foreshadowed...",8.0,"Charlie Booker has a knack for foreseeing trends, and The Waldo Moment seemed to presage the populist movements around the world...Greece, The Philippines, UK (Brexit) and of course the USA in particular the 2016 presidential election. It seems Charlie also foresaw accusations about a now former Prime Minister and student antics with a pig.Waldo is quite crude yet he gets much of the population to adore him. But Waldo is part of something bigger, a worldwide scheme that is more than a political campaign.One thing I didn't really get was that no-one dared to go behind the screen and wring their hands around the man behind Waldo!! Why not?"
2,6, Apolitical is political.,7.0,"'The Waldo Moment (2013)' seems to be one of the more polarising episodes of 'Black Mirror (2011-)'. Perhaps it released ahead of its time or perhaps it isn't overtly sci-fi enough. Personally, I think it fits in just fine with its peers. It has only gotten more relevant since its release, in a myriad of nearly impossible to predict ways. Once again, Brooker creates a bleak, thematically rich story that keeps its focus firmly on character. Though they aren't the most well-rounded in the show, the central figures of this story all feel like real people. Possibly the piece's best and most frightening aspect is the way in which its in-universe public react to the events they're experiencing. It hits close to home and has plenty to say. The same can be said of the entire affair. It's a solid, entertaining slice of low-key science-fiction. Honestly, I don't understand some of the apparent hesitation towards it; it's as much 'Black Mirror' as any other episode is. 7/10"
2,6, 5,5.0,"So the producers did great job for whole 35minutes with interesting plot of this episode and they've decided they're doing too well and make the ending miserable disappointment, really sad."
2,6, The weakest link,5.0,"Jamie is a mediocre comedian who lends his voice to the blue animated bear Waldo. Waldo is in the style of the ""South Park"" series, only at a much lower and more primitive level. During the election, the producers use Waldo to ridicule the candidates. The unexpectedly good reaction of the public leads them to put Waldo in the race. But Jamie is not material for a politician and snaps under pressure. In an attempt to destroy the campaign, he destroys his private life, while politics goes on, as if nothing had happened.The idea is good, especially because it is not far from reality, but the realization is poor, or perhaps, a better word is lazy. Political satire is lukewarm, and human drama does not arouse any emotions, both because of the weak script and because of the unimpressive acting.5/10."
2,6," This one appealled to me, although my wife found Waldo annoying lol!",9.0,"The Waldo Moment is a brilliant satirical look at the state of modern politics.This one isn't deep or even that clever, so far as Black Mirror episodes go. But it is very funny and actually quite tragic that it feels so true to life.The Politics, the society, and the media are all very accurately portrayed. And in the real world we all have to admit that Waldo would get votes, he may even win if he really did run for office!9/10 for it's sheer simplicity"
2,6," Not without some merit, but the series is losing its way here, by going too far...",5.0,"While the postscript is more crucial than the episode here (so don't press the stop button too soon!), a crude, foul-mouthed blue-coloured cartoon bear destructive of and tending to trivilalise political debate only has so much mileage in it, one would feel. Even though people might indeed cheer on such pricking of the pompous political bubble (as they did with ""Spitting Image"" in the 80s), it was - as the Conservative candidate says here, that oh-so-pompous and ostensibly-irrelevant party-political system ""that built the roads"" (this is actually the most worthwhile comment in the episode, even though it was most likely not meant to be!)And of course the British state also built hospitals and dispensed life-saving drugs and carried out operations too. And kept the peace and allowed many people who want to to make progress in their lives.So could this disrespectful blue character called Waldo really be used to promote dissent, encourage violence and revolt and give rise to a police state? Is today's image online and in other forms really so indestructable once created? Would attempts by states to eradicate the phenomenon only encourage its popularity, and drive it underground? Do (most) people really want to abandon conventional politics and replace it with nihilism?These are worthwhile questions, conceivably, but the episode only hints at them, deciding to stay mostly with the first emergence of the Waldo phenomenon; and for this viewer at least, the behaviour of the bear - with or without his original handler (played by Daniel Rigby) - actually makes a slightly slimy Conservative candidate look sensible, sympathetic and likeable (and he did win the election anyway); while encouraging fellow feeling for a rather hopeless female Labour Party candidate who always knew she had no chance of winning (that's actors Tobias Menzies and Chloe Pirrie, if anybody's especially bothered).While ""Black Mirror"" can be quite tremendously clever and thought-provoking, here - one believes - it is taking a vaguely sensible/conceivable premise and stretching it well beyond its limits. And the targeting is off, too, as the main condemnation here is not against a failed/failing conventional political system, but against people who can readily be encouraged into hooligan behaviour.So not much new there, really?Interestingly, Waldo's ultimate owner (played by Jason Flemyng) here does - in one sentence of dialogue - raise issues about sidestepping parliaments by going straight to the people online ... of a kind therefore very familiar to those who recall the 2017 Emma Watson/Tom Hanks vehicle ""The Circle"". While the latter film was weak by any standards, it considered the issue referred to quite effectively (at moments at least), while ""The Waldo Moment"" is entirely tangential to this genuine threat that DOES exist for democracy; preferring instead to go with a cartoon character crudely obsessed with its own phallus.Somehow we've slightly missed the target, haven't we?"
2,6, Anti-politics,6.0,"This review contains spoilers for the third episode of the second season of Black Mirror entitled ""The Waldo Moment.""The episode opens with the political season ramping up in the United Kingdom. Waldo, a cartoon bear controlled by Jamie Salter, interviews politicians and authority figures in a comedic way. Waldo is incredibly popular among the British public. During a brainstorming session, the people working with Waldo suggest entering the political race.The episode has a big links to political systems across the world. This episode is a good commentary on how a political system can fail a large portion of a population. Although this is one of the weaker episodes in the second season, the episode had as much if not more to say in its plot and themes. The Waldo Moment presented a theory that the public could be motivated to choose a candidate that stands for nothing. This choice can be reflected by elections recently where many voters feel alienated and disenfranchised by the choices that are presented to them. Waldo is simply a conglomeration of these voters.I would recommend ""The Waldo Moment"".Grade: B"
2,6, Who painted my mirror ?,7.0,"This is a funny , tragic and interesting tale of a guy whos career as tumbled to rock bottom. However he has one saving grace a cartoon based character he lends his voice too. However now that looks to be in danger he needs a new idea and quick.Main flaw , its nkt black mirror imho however i have a feeling that when the last black is cast every episode will marry up so maybe im missing somethingA wobbly 6"
2,6, Like an extended newswipe clip ( Charlie Brooker UK show ),7.0,"I think Charlie got his shows confused , although the plot significantly points out how you can end up with a President Trump this is in the main a comedy, a look at British politics, and the rise of populism.Its a good one of show but not very black mirror."
2,6, Not as great as the others,7.0,"This is a good episode, but not as fantastic as the others. It's the weakest episode by far. The story is about a failed comedian who voices a comedic cartoon named Waldo. It is a political satire. The acting is great but the story lacks something."
2,6, Captures election back stage manipulation perfectly.,8.0,"This episode was dragging along a bit, only holding my partial interest - until the meeting with a shady US representative. What followed was a very clever and thought provoking 5 minute scene carried solely by extremely well written dialogue.I thought the whole episode was meant to pivot around this scene. It did for me and I increased the stars accordingly.A few stories have been a little, (or a lot), cringe-worthy with a slightly alien, (very British), approach to the overseas viewer. Overall I keep watching and looking for the gems."
2,6, Spoilers of the Future Politics!,7.0,"I don't know why this episode is rated so much low! Perhaps it was released back in 2013 so that people might not understood it's premises!
But when we see today's world of politics, we might get a question in our mind.
Is it a Spoiler of our future politics?Anyways! A great episode it was and the leading character ""WALDO"" is totally Badass. Ha ha the way he talks, the instant way he make jokes of MPs are really cool. Overall it was not that Hi-Tech futuristic technology concept type episode, like all other previous episodes of Black Mirror, but I personally Loved it.And that's why gonna rate it for 7 out of 10 Stars. This episode contains some abusive words and a sexually explicit scene so avoid watching with family!"
2,6, Extrapolation of current politics,7.0,"Weaker (but not weak) episode. The the episode further develops the topics featured in National Anthem and thanks to other aspects The Waldo Moment will be relevant for a long time. Voter apathy, ad hominem attacks, lies, rigidity, idleness and populism are, unfortunately, parts of modern politics. The episode exagerates most of it, but the similarity to real world is still there."
2,6, I see what this episode for...,6.0,"I see political apathy and Waldo.... this episode spend too much time with Jamie. I want to see after Jamie resigned. But Waldo was very funny and slow tempo of the episode made me feel like I was one of the public in the episode, which was great."
2,6," Great, underrated episode",10.0,"I don't know if this episode really deserves a 10 rating, but it was a fantastic episode, in a highly inventive series. Definitely not the weakest in the series: that one would be Nosedive. (Even that episode was really good, but the first 40 minutes were pure torture to get through.)This episode deserves a much higher rating, overall. Ignore the negative reviews and judge for yourself."
2,6, Ehh,5.0,"Definitely a low point in the show as a whole. Although it was semi prophetic of society, it just didn't strike me as intense and unnerving as most other episodes. I think the stakes were just too low.
It was also the only episode I can remember where I didn't actually feel bad for one or more of the characters by the end. I'm not sure if Jamie just wasn't very sympathetic or if I felt he basically brought the hardships at the end on himself. Either way, I just didn't really care what happened to him. 5/10"
2,6," Episode has potential, but ultimately falls flat",6.0,"I ultimately appreciate the message the writers convey here about the intersection of politics, pop culture, comedy, and technology. However, everything about the Waldo character falls flat. Waldo is unpleasant to listen to and look at. It doesn't help that the writing for the Waldo character is terrible, he's neither funny nor insightful in any way. The actor voicing him does a terrible job at it, the timbre is unpleasant and he doesn't sound like any kind of professional voice actor. He sounds like if you asked any rando on the street to immediately come up with some kind of fake voice.I suppose the lack of depth to Waldo's insights was partially intentional, a statement on the influence of shallow comedy on real politics. Either way nothing about the Waldo character works, to me, hiring an actual professional voice actor could have gone a long way here."
