Season Nbr,Episode Nbr,Title,Score,Comment
1,1, Perhaps accurate about human nature and the media...but too gross and easy to hate this episode.,3.0,"This first episode of ""Black Mirror"" is a lousy one because compared to later episodes it's very disappointing. It's also pretty revolting and I suggest you perhaps see this one AFTER you've seen a few of the better ones!The show begins by someone announcing on YouTube that he's kidnapped a member of the royal family. Their demand is that the Prime Minister have sex with a pig...live and unaltered on national television. Much of this episode is insightful when it comes to human nature and the media. That being said, surely there must have been a BETTER way to get the point than this...especially since it involves pork. You could do better and they DO get better."
1,1, Let's See If It Sticks!,5.0,"Other reviewers assure me that this series is worth a look. I agree with a previous commentator, that had this been the first episode I watched, it would be the last. It did pique my interest because all of us are voyeurs and are wondering how it will be pulled off. Well, no such luck. I thought that the writers would be able to come up with a satisfactory conclusion. So, it's performance art. So the guy who did it showed us our dark side. It's still disgusting and I'm not prudish about most things. The other thing is that no government agency would ever let such a thing proceed. I will watch the next one on the promise that something more palatable would come forth."
1,1," Sick, Tense and Realistic Story",8.0,"In London, in Christmas, the Prime Minister Michael Callow (Rory Kinnear) is awakened by his advisors Alex Cairns (Lindsay Duncan) and Julian Hereford (Donald Sumpter) that show a video of Princess Susannah of Beaumont (Lydia Wilson) to him. The princess is the pride and joy of the Royal Family and beloved by the people, and she tells that she was kidnapped. Further, the kidnapper demands that Michael have sex with a pig on live television; otherwise he would kill her. Michael's wife Jane Callow (Anna Wilson-Jones) supports her husband while his advisors try to hire a porn star to perform the act while the secret service tries unsuccessfully to track the kidnapper down. Meanwhile the media seeks for news at any cost. What will the prime minister do?""The National Anthem"" is the promising beginning of ""Black Mirror"", with a realistic and sick story of terrorism. The plot is tense and the attempt to find the responsible in short time is still impressive. The story shows the power of Internet and how unethical and destructive the press can be in certain situations seeking for a scoop. The conclusion is very ironic. My vote is eight.Title (Brazil): Not Available on DVD and Blu-Ray"
1,1," Black comedy, but only just.",6.0,"I know the reviews for this one are generally hugely positive, but I find the first episode a bit of a stumbling block, When you think of subsequent episodes this one just lacks the true cutting edge. Sure it's a disturbing watch, and the performances are superb, fair play to Rory Kinnear, he is superb here, such an amiable actor, it adds to the repulsion and sorrow you feel for the character. The problem I have with this one, is the only picture I have in my mind is David Cameron holding that piglet, distressing all round. It's slick in delivery, it's definitely sick, just a story I'm not particularly struck on, a good watch though."
1,1," ""The Public, the Palace, and the Party insist on compliance.""",4.0,"I think we've pretty much hit the lowest common denominator here, haven't we folks? There are those reviews who claim that this show was meant to make us think, and that's probably true. I think it points out the cultural rot that's invaded our lives via easy to use technologies that make a connection with millions of people possible in an instant. I'm new to Netflix and 'Black Mirror', so I'm actually somewhat surprised that the terrorist act committed in the story hasn't been tried for real by now, since this episode aired back in 2011. But what the heck, with ISIS beheadings going viral and all manner of perverse images showing up on the Internet and spinoff technologies like Facebook and Twitter, it's probably just a matter of time. I can say one thing realistically, if this event were to happen for real, I would not be participating in the voyeuristic show, no matter how sensational. And if I were ever in the position of the Prime Minister, my reaction would be like the guy in the joke who encountered his friend, bitten on the butt by a rattlesnake. The alternative to sucking out the poison would be - 'You're gonna die'."
1,1, Incredibly bold and prescient,9.0,"With all the allegations (uncorroborated) around Piggate (just Google it), this series opener was incredibly prescient big time. Charlie Brooker is one talented guy, and his creation of Black Mirror really tapped into our social media/mobile phone/internet/Facebook obsession. This was before Pokemon Go by the way.This episode is disturbing in many ways, and you can sort of imagine pranksters pulling off such a stunt to humiliate those in power. Wow! Anyway, you are kept guessing until the end and you wonder will the British Prime Minister cave into the demands of the kidnapper? The end is skilfully filmed, and maybe there are DVD outtakes on this."
1,1, The episode that kept me for years from watching any more of Black Mirror,3.0,"After hearing about Black Mirror for a while, I thought I'd take a look, and took a look at the first episode. After 10 minutes I turned it off, although then mild curiosity lead me to read an online synopsis and took a quick look at the end. I didn't watch another episode for 4 years, because I couldn't see how anything that began so badly could possibly worthwhile. (Recently a friend who said this was the worst episode of the entire series convinced me to watch U.S.S. Callister, which was great, so now I'm ready to watch more).For me, National Anthem was a dismal fail. Basically it seemed to be a serious drama about an absurd situation. I actually started getting annoyed even before it got ridiculous because of the way the cabinet kept drawing things out for dramatic effect: Really? you're going to turn off a kidnapping tape in the middle to make some cryptic remarks before you let your boss the Prime Minister see the rest of it?Then the big twist came in and I was like, really?From what I've read there are other sensibility issues. Of course, satire doesn't have to make sense, but in spite of the premise, it isn't filmed like satire. And if you film it realistically, you need to give it a feel of realism, at least in the beginning (for example, Dr. Strangelove, which established a sense of reality before getting absurd). If the first five minutes had been done better, I wouldn't have been so put off by the central premise that I couldn't bring myself to continue.Why Black Mirror's makers felt this was the episode to start with is puzzling, although it's also puzzling why they would make it at all.If you haven't seen Black Mirror, don't start here."
1,1, Pigs might fly,8.0,"This has to be one of the most eye-opening pieces of TV I've ever watched. The premise is shocking to the point of unbelievability but a whole lot easier to accept now that the life-imitating-art story of ex-P.M. Cameron's university capers with a porker has come to light. Basically, a young Prime Minister, with similarities to let's say Tony Blair or the afore-mentioned then P.M. in waiting Cameron is woken up by the shocking news that the popular princess of the day, with similarities to let's say Princess Diana, has been kidnapped apparently by terrorists whose sole demand for her release is that said P.M. must commit a sex-act on live T.V. with a pig.It's realistically shot in almost real-time, with social media fanning the flames as the story spreads, augmented by ""Breaking News"" CNN / Sky News-type television updates making more tense the looming four o'clock deadline for the P.M.'s moment of porcine truth. Behind the scenes, every possible way-out is gradually closed down to him and the fantastical finale proceeds with the twist in the tale (or should that be tail?) as the truth is revealed, in the process making sense of subtly inserted seemingly unrelated trivial premonitions in the lead-up.As a commentary on celebrity culture, the eroded public perception of the status of politicians, the limits of censorship and just what people will and won't watch on their TV screens it's savagely on point, even more so today with ever more invasive reality TV shows given ever more network time.A piece like this couldn't work unless two vital factors were in play, firstly that it's played arrow-straight by all the actors and also that there's leavening humour inserted too (evident even in the title of the episode, as we wonder whether the P.M. will get up for his monarch). Both these boxes are positively ticked leaving the only really exceptionable segment being where a female reporter has to sex-text images of herself to one of the P.M.'s insiders to get an exclusive. I wasn't totally convinced by the last scene either showing how the P.M and his wife were coping one year on as I didn't think it added anything to the story.That said, I watched it with one jaw gaping and the other laughing at what I was seeing. This really does feel like it's pushing at the limits of television political comedy but rather like the depiction here of the various representatives of the British public unable to resist tuning in to watch, just you try and look away from this one once you've started."
1,1, Change the channel.,7.0,"'The National Anthem (2011)' is the first entry in Charlie Brooker's 'Black Mirror (2011-)'. It tells the tale of a kidnapper's unconventional and cruel demand: the prime minister must have sex with a pig on live TV. The piece starts out somewhat blackly comic, with the absurd request contrasting with the absolute sincerity with which it is treated. However, it soon becomes clear that this command is genuine and genuinely distressing. The experience escalates into a scrambled search for the kidnapper in an attempt to avoid what seems inevitable. The situation is properly tense and its culmination is properly disturbing. Rory Kinnear gives a great performance as a man pushed to the edge and the affair's pacing is veritably propulsive. It's not nice but it's compelling. It is also clearly trying to say something, which it does successfully without beating its audience over the head. Having said that, its observation does feel slightly 'empty'. It's not the most astute message but it works well enough. In the end, this is an entertaining - if not exactly enjoyable - short film with a dash of satire and a heap of horror. 7/10"
1,1, 9,9.0,It was so creepy and disturbing but also really entertaining at once. Really enjoyed first episode. Prime minister made the right decision.
1,1, What would you do?,8.0,"The princess was kidnapped. Via a YouTube video, the kidnapper demands that the Prime Minister have sexual intercourse with a pig in a live television broadcast, in exchange for the Princess' life. While police are trying to track him down, and the crisis staff monitors the reactions of the public, we observe the horrific dilemma of the Prime Minister who is slowly giving in to the pressure, until a complete breakdown.While the series is largely based on SF and futuristic premises, this episode is a purebred drama, quite possible at this very moment. The episode deals with the terrifying power that the Internet already possesses, the psychology of the masses, and the influence of the media on public opinion, questioning the policy of non-negotiation with terrorists, all through the prism of an individual in a hopeless situation.Although the script has some obvious flaws, and the episode somewhat flirts with black humor, the overall impression it leaves is deeply shocking, quite frightening, and thought-provoking.8/10."
1,1, Sex With A Pig,8.0,The Princess Susannah is kidnapped and her kidnapper had posted on YouTube a video. He wants the prime minister to have sex with a pig on live television.One of the reporters sexts photos of herself in the washroom. She goes into the supposed building where the princess is supposedly kept but instead gets shot by authority in the leg.The prime minister has no choice but to go ahead and do the act so he unzips his pants and we see him in his underwear. The pig is eating happily. He then performs the act and we see the audience's reaction.In the end the prime minister's approval rating has gone up a lot after one year but the only thing is his wife is not happy. She acts happy in front of the cameras but when they are home she stomps away. The princess is now pregnant.
1,1, An attention-grabber first episode,6.0,"I would not go as far as writing that I ""liked"" this episode, but for sure it attracted my attention.It works very well as a critique of a media-obsessed world, populated by hypocrites and voyeurs. It also strikes very close to our present situation and due to its dark nature, it is distubing. Likable, not so much, but definitely attention-grabbing."
1,1, Dare I say this might be a Marmite episode based on the reviews i have read!,10.0,"Boom!You can see from my rating how much I loved this episode. What a way to kickstart a new binge watch that I had been avoiding after seeing Bandersnatch last year!The National Anthem is a work of satirical art. It dared to suggest something so off the wall and ridiculous that it had me in shock and hysterics at the same time. It felt so fresh and original it drew me in and kept giving me more!I never believed for a second that the writers would actually see this through to it's conclusion, but hats off them, they dared to go there!Wow, all the craziness and satire was stripped away and replaced with something so perverse and sick I could really feel it! However uncomfortable it was to watch, I felt so sad for the lead character, sickened by the society, appauled by the reactions!For a story this silly to play out the way it does and still draw these emotions from the viewer has be the work of genius.Clearly many people hate this episode, I loved it!10/10"
1,1, What a Completely and Ridiculously Stupid Concept,1.0,I heard a lot of good things about this series and I had high hopes. If I can judge the series by S01E01 I would call it a disaster.People actually liked this episode? How is that possible? A kidnapped princess? I wouldn't wave to a camera to save a royal. Why didn't they make that royal pig have sex with the pig? If this is any indication of the quality of this series then I am getting out early.
1,1, The way we live now ... and it doesn't look too great,9.0,"In the first outing for Charlie Brooker's ""Dark Mirror"", a number of familiar-faced actors perform seriously and persuasively enough to capture the viewer within about 5 (of max 45) minutes, with a story presented seriously and realistically, and yet perfectly mixing the deadly serious with the eccentric and bizarre. It's a deeply British setting with just a hint of Doctor Who about it, and it homes in neatly on the tensions potentially and actually existing in the Prime Minister/British people/Royal Family triangle. Symbolic figureheads the Royal Family may be, but few in Britain have much doubt that - say - soldiers will ultimately do more to protect them than they will top politicians. In this case, it rather quickly becomes apparent that Brits expect a PM (and PM's wife) remarkably similar to David and Samantha Cameron to make a sacrifice for the sake of a young and popular Royal. The essence of this - in art here, as in real life - is just that the Royals are born into the job (whether they want to be or not), and in that sense somehow innocents, while politicians are elected and, if they can't stand the heat, they have no business being in politics in the first place.Anyway, what the kidnapper expects from the PM is bizarre (and all the more so given the apparently (truly) coincidental way in which life later (not until 2015, albeit retrospectively) apparently seemed to sort-of imitate art). In essence, it involves humiliation, and we immediately find ourselves wrongfooted by the fact that this terrorist demand - apparently associated with a genuine threat to the victim's life - does not involve money or deep political motives, but does require that the PM degrade himself publicly. It might be somehow funny or inconsequential in that case, but certainly does not seem so.The question mark here all the time is who is actually been targeted by the maker(s) of this piece, and the primary target would seem to be the electronically-connected world we live in. Certainly, there is tangible criticism for millions in the UK and around the world who are prepared to watch (and stay watching) the PM's humiliation, and in this sense - paradoxically - this modern, cutting-edge programme looks remarkably traditional in suggesting that the man at Number 10 is actually a hero who does the right (if nevertheless self-diminishing) thing.Happily, the kidnapper does not come out of this heroic, yet we still feel disturbed when we learn of his motive.Overall, it's clever and disturbing and dark, and definitely thought-provoking. It's also executed pretty deftly."
1,1, Strange beginnings,7.0,This review contains spoilers for the first episode of the first season of Black Mirror.The first episode of Black Mirror concerns a royal princess that is kidnapped with the ransom being the prime minister must have sex with a pig on live television. The episode covers the beginning from the ransom video being displayed to the revelation of the ransom. The British government is in panic as they seek to stop the media frenzy caused by the royal princess' kidnapping and ransom.The mystery of the episode is the best part. The revelation at the end being that the entire act was a work of art and reflection on modern society was great. This part elevated the episode for me and aided in the enjoyment of the episode.The characters of this episode are well-acted but the characters themselves are two-dimensional. Each character has a single motivation and that is all that carries them through the episode. The wife of the prime minister simply did not want her husband to engage in the act even when it was to save someone's life. It did seem like the episode should have focused more on the theme of the reflection on society rather than the focus on characters.The directing and editing are decent. The episode's visuals will not wow anyone but it will tell the story.I would recommend the first episode of the first season of Black MirrorGrade: B
1,1, The Power of Social Media,7.0,"Plot (3.5/5)Story (4/5)Soundtrack (4/5)They did it great.
Dialog (4.5/5)They speak way too fast.
Graphic (4/5)Reasonableness (5/5)All make sense.
Entertainment (3.5/5)Well, It is weird but also a bit entertaining.
Overall (4/5)This episode shows how powerful Social Media is. Even Government can't stop them."
1,1, He who laughs last,9.0,"I do believe that Mr Charlie Brooker no longer doing his 10 o'clock Live satirical news rival show decided that it would be great fun to do a story that attacked the then Prime Minister of Great Britain David Cameron.Cameron hated the comedians like Carr, Mitchell, Merton , Brooker etcBrooker didn't have time for The Tory partyEnjoy"
1,1, Degrading piece of garbage,1.0,"This program is described as being in the science fiction or thriller genre. Other people told me it was like a contemporary version of the twilight zone. None of these descriptions is remotely like what was presented in the first episode of the series. This episode is a twisted piece of filth that degrades the many British actors who lowered themselves to take part in it. It wasn't even much of a mystery, since there is a very clear spoiler early in the episode that gives away the name of the perpetrator. Don't waste your time. I will not be watching any more of this series. I wonder if this was written before or after the famous story about Prime Minister David Cameron and the pig."
1,1, Maybe something was lost in translation? Yank here.,2.0,"This is so bizarre and unpleasant to watch, it's amazing the show survived. I just wonder if there is a subtext here that Americans are missing."
1,1, Great start,8.0,"The satirical story is unsettling. Unlike the other episodes in Black Mirror, The National Anthem is set on the present and it deals with our obsession of social media and how news spreads like wildfire. And a PM doing it with a pig...really disturbing. But the acting is great."
1,2, Creative Second Effort,9.0,"This, of course, is an outrageous allegory about the foundations of our decline. The plot involves a man who seems to be comfortable. His bodily needs are taken care of. He seems somewhat free. But we soon find out that his daily routine is to get on a stationary bike and earn merits. These accumulate and can be exchanged for the the things that the governing body (whatever that is) is willing to sell them their products. They can get snacks from vending machines, watch pornography, mundane music, watch fat people being abused, on and on. They can also try to leave their station by giving up their merits in order to try to be celebrities themselves. It requires a huge number of merits (in the case 15 million) which could take six months to accumulate. Two people find each other and one makes a big sacrifice to allow that person to realize her dream. She must audition for three disgusting show-biz types in a kind of Hunger Games interview. We learn quickly that the decks are stacked and the prospect of pedaling a bicycle for eternity versus a modicum of celebrity is a hard decision. One of the most striking things about the episode is that people are represented to one another as avatars. When the girl sings in her audition, she sings before an arena full of cartoon figures who are the extension of real people. An excellent second episode after the first sickening one. I'll keep moving on to the third."
1,2, The Performances,6.0,"In a future society, most of the people work like slaves riding stationary bicycles to generate energy. In return, they receive ""merits"" that are consumed in fast-foods in vending machines and games and shows that they are forced to watch in giant screens in the single compartment where they live. When the worker Bingham ""Bing"" Madsen (Daniel Kaluuya) overhears his fellow worker Abi (Jessica Brown Findlay) singing in the unisex toilet, he falls in love with her. He convinces her to participate in the talent competition show ""Hot Shot"", where she may improve her life if she is selected by the judges Hope (Rupert Everett), Charity (Julia Davis) and Wraith (Ashley Thomas). Bing uses his savings of fifteen million merits that he had inherited from his brother to buy a ticket to Abi. However the judges offer to Abi to work in the porn channel ""Wraith Babes"" instead and she accepts the offer expecting to improve her life. Bing is angry with her choice and decides to save merits to go to the ""Hot Shot"" with a sharp piece of glass. What will he do in the contest? ""Fifteen Million Merits"" is a pointless episode of ""Black Mirror"" about a technological dystopia. The viewer sees the episode expecting something different and watches a weird story with an unintelligible speech. There is an obvious criticism to the excessive use of television, fast-food and video-games but the result is disappointing. My vote is six.Title (Brazil): Not Available on DVD or Blu-Ray"
1,2," ""I just want something real to happen. Just once.""",7.0,"Anybody here see and remember the movie ""The Running Man""? It starred Arnold Schwarzenneger and took place in a dystopian future in which the mindless masses were kept entertained with programs featuring blood and violence. You have pretty much the same thing here except the violence has been replaced by celebrity sex by players who pay their dues on the way to becoming the next 'Hot Shot'. All throughout, the story hints at the idea that the principal characters Abi (Jessica Brown Findlay) and Bing (Daniel Kaluuya) won't succumb to the relentless pressure of achieving that status, knowing that the only thing they each want to do is what makes them happy. But that choice is made impossible by celebrity judges Wraith, Hope, and Charity, who promise to send the fan favorites back to their lives of daily boredom scoring points while creating energy for the State and watching mind numbing programs of questionable value. An alternate ending in which Bing slashes his throat would have been considered more acceptable to this viewer, in as much as he seemed to be fiercely opposed to the choice he was offered, but in the end he too failed to deliver on his principles. Not that he had to be that drastic, he could simply have returned to his previous status. As Rod Serling once posited in one his more memorable Twilight Zone episodes, I guess it's all in the 'Eye of The Beholder'."
1,2," Seems so long ago, yet so prescient",8.0,"I still haven't seen Black Mirror season 3 onwards (I guess I have to subscribe to Netflix eventually). I'm only now catching up on three episodes from the early years: this and the third one in season 1, and the Christmas one with Jon Hamm.Fifteen Million Merits has several layers that is akin to a rorschach test. What you see depends on your priority in life. Consumerism? Capitalism? Talent shows? Simon Cowell? You have it all wen you see this."
